,title,date,content,link
36,Qantas warns rising fuel costs may hit fares By Reuters,"Published Sep 24, 2023 07:55PM ETUpdated Sep 24, 2023 10:15PM ET","Position added successfully to: 
By Byron Kaye and Himanshi AkhandSYDNEY (Reuters) -Australia's biggest airline Qantas Airways said on Monday it will spend more than previously planned to improve ""customer pain points"" but warned spiralling fuel costs may force it to raise fares from already-elevated levels.The update sent its shares down as much as 2.5% to a one-year low as investors questioned the airline's ability to grow profit given persistently high costs.The company, under a new CEO, is trying to navigate a path between reassuring customers it is taking seriously complaints of widespread service problems while telling investors it can contain a surge in costs linked to tight oil supply.The airline that sells three in five Australian domestic fares has seen its reputation tumble in its home market as its handling of the post-COVID travel revival brought a wave of flight cancellations and reports of lost luggage. Adding to its woes, last month the antitrust regulator sued Qantas accusing it of selling fares on thousands of already-cancelled flights in 2022. Qantas also lost a union lawsuit when the High Court found its 2020 sacking of thousands of groundstaff was illegal.The so-called ""flying kangaroo"" said it would now spend A$80 million ($52 million) on ""customer improvements"" on top of the A$150 million previously flagged.""This additional investment is aimed at addressing a number of customer 'pain points' through improvements such as better contact centre resourcing and training ... more generous recovery support when operational issues arise, a review of longstanding policies for fairness and improvements to the quality of inflight catering,"" it said in the trading update.At the same time, it said its forecast half-year fuel bill would jump by A$200 million ($129 million) to A$2.8 billion if the 30% jump in fuel prices it had faced since May persisted.""The group will continue to absorb these higher costs, but will monitor fuel prices in the weeks ahead and, if current levels are sustained, will look to adjust its settings,"" Qantas said.""Any changes would look to balance the recovery of higher costs with the importance of affordable travel in an environment where fares are already elevated.""RBC Capital Markets analyst Owen Birrell said the company would likely absorb the higher fuel costs ""until its target margins come under pressure and then would seek to claw back those costs through capacity cuts and higher fares.""We don't believe a material earnings shift is feasible from here given rising competition, growing consumer/business cost pressures and incoming re-investment in the product/platform,"" he said in a client note.($1 = 1.5559 Australian dollars) 
",https://www.investing.com/news/stock-market-news/australias-qantas-flags-hit-from-higher-fuel-prices-3181272
37,Trump lawyer says NY attorney general has no fraud case By Reuters,"Published Sep 22, 2023 06:17AM ETUpdated Sep 22, 2023 08:22PM ET","By Karen Freifeld and Jonathan StempelNEW YORK (Reuters) -A lawyer for Donald Trump on Friday accused New York Attorney General Letitia James of ignoring ""everything"" as she pursues a civil lawsuit alleging that the former president ran a systematic fraud at his family business.Christopher Kise, Trump's lawyer, made the accusation at a hearing in a New York state court, just 10 days before the scheduled Oct. 2 trial.Justice Arthur Engoron is considering arguments by Trump, his sons Donald Jr. and Eric, and the Trump Organization that the case should be thrown out because there was no fraud, no one was harmed, and the claims are too old.James, in contrast, wants a ruling even before the trial starts that the defendants are liable for fraud.Engoron plans to rule on Sept. 26 on both sides' motions, and suggested that bigger principles are at stake.""We're talking about fairness and honesty in the marketplace,"" he said at the hearing, which lasted nearly five hours. ""The fact that nobody was hurt doesn't mean the case gets dismissed.""James wants at least $250 million in penalties, and to bar Trump and his adult sons from running businesses in New York.Trump holds a big lead in the race for the 2024 Republican presidential nomination, despite also facing four criminal indictments where he has pleaded not guilty.He has denied all wrongdoing, and branded the cases a Democrat ""witch hunt"" against him.THROUGH THE LOOKING GLASSJames accused Trump of lying in financial statements between 2011 and 2021 to obtain better terms on loans and insurance, defrauding banks and insurers.She said the lies included overvaluing properties including his Mar-a-Lago club in Florida and Trump Tower penthouse in Manhattan, and inflating his fortune by as much as $3.6 billion.Kise said the evidence was not there, that James' contrary statements did not make it so, and that valuation disputes were immaterial.""The foundation of the case is to ignore everything,"" Kise said. ""The case comes down to prosecuting the defendants for engaging in successful business transactions.""James maintains that Trump knew his valuations were false.This allegedly included valuing Mar-a-Lago at $739 million by pretending it was unrestricted property though Trump had given up rights to develop it other than as a club, and reporting that the penthouse was nearly triple its actual size.""In (the) defendants' world, there's no objective truth,"" said Andrew Amer, a lawyer from James' office. ""Defendants have clearly stepped through the looking glass.""LAWSUIT AGAINST JUDGEIn June, a state appeals court in Manhattan dismissed claims against Trump's daughter Ivanka Trump and various other claims predating July 2014 or February 2016 because of statutes of limitations.The court left it to Engoron to determine which parts of the case could proceed. Engoron will also rule on James' request to sanction the defendants for repeatedly raising ""frivolous"" arguments he had already rejected.At Friday's hearing, the judge appeared dissatisfied when Kise suggested that banks might not have relied on Trump's valuations when making loans.""You cannot make false statements and use them in business,"" Engoron said, banging his fist.Last week, Trump sued Engoron, accusing him of taking too long to narrow the case.The lawsuit sought to delay the trial, to allow the defendants to prepare properly after Engoron decides which claims the attorney general can pursue.Defense lawyers have also accused James of ignoring the June appeals court decision.The appeals court is expected to decide next week whether the trial should proceed as scheduled. 
",https://www.investing.com/news/stock-market-news/trump-ny-attorney-general-to-argue-over-scope-of-looming-fraud-trial-3180480#comments
38,"Thailand expects Tesla, Google, Microsoft to invest $5 billion -prime minister By Reuters","Published Sep 24, 2023 01:45AM ETUpdated Sep 24, 2023 01:50AM ET","BANGKOK (Reuters) - Thailand's Prime Minister Srettha Thavisin said on Sunday the country expected to receive investment of at least $5 billion from Tesla (NASDAQ:TSLA), Google (NASDAQ:GOOGL) and Microsoft (NASDAQ:MSFT).""Tesla would be looking into an EV manufacturing facility, Microsoft and Google are looking at data centres,"" he said, without detailing whether the $5 billion was expected to be a combined investment or made individually by each company.Tesla, Google and Microsoft did not respond immediately to requests for comment.Srettha was speaking to reporters in Bangkok after attending the U.N. General Assembly in New York where he also held talks with company executives earlier this week. Fresh foreign investment would boost Thailand's flagging economy, which is expected to grow by 2.8% this year, less than previously projected, due to weaker exports. Srettha spoke with Tesla CEO Elon Musk last week about the electric vehicle sector. Thailand, Asia's fourth-largest automobile assembly hub, has been offering incentives to EV and battery makers, and tax cuts to local EV buyers, to remain a regional auto centre.  
",https://www.investing.com/news/stock-market-news/thailand-expects-tesla-google-microsoft-to-invest-5-billion-prime-minister-3181190#comments
39,"Striking writers, Hollywood studios to meet on Sunday as talks stretch on By Reuters","Published Sep 23, 2023 11:17PM ET","(Reuters) - Negotiators for the striking Writers Guild of America (WGA) and Hollywood studios will meet again on Sunday after a fourth day of talks failed to reach a deal.The WGA and the Alliance of Motion Picture and Television Producers (AMPTP), which represents studios like Walt  Disney  (NYSE:DIS), Netflix (NASDAQ:NFLX) and other media companies, held talks on Saturday as the strike reached its 145th day.Writers walked off the job in early May after negotiations failed to agree on compensation, minimum staffing of writers' rooms, the use of artificial intelligence and residuals that reward writers for popular streaming shows.The SAG-AFTRA union, comprising 160,000 members from actors to stunt performers, joined the writers in July, calling for a work stoppage and putting Hollywood into two simultaneous strikes for the first time in 63 years.  
",https://www.investing.com/news/stock-market-news/striking-writers-hollywood-studios-to-meet-on-sunday-as-talks-stretch-on-3181089
40,Inside Vietnam's plans to dent China's rare earths dominance By Reuters,"Published Sep 24, 2023 09:05PM ETUpdated Sep 24, 2023 09:31PM ET","Position added successfully to: 
Position added successfully to: 
Position added successfully to: 
By Francesco Guarascio and Khanh VuHANOI (Reuters) - Vietnam plans to restart its biggest rare-earths mine next year with a Western-backed project that could rival the world's largest, according to two companies involved, as part of a broader push to dent China's dominance in a sector that helps power advanced technologies.The move would be a step toward the Southeast Asian country's aim of building up a rare-earths supply chain, including developing its capacity to refine ores into metals used in magnets for electric vehicles, smartphones and wind turbines.As an initial step, Vietnam's government intends to launch tenders for multiple blocks of its Dong Pao mine before the year's end, said Tessa Kutscher, an executive at Australia's Blackstone (NYSE:BX) Minerals Ltd, which plans to bid for at least one concession. She cited unpublished information from Vietnam's Ministry of Natural Resources and Environment, which did not respond to requests for comment.The auction's timing could change but the government plans to restart the mine next year, said Luu Anh Tuan, chairman of Vietnam Rare Earth JSC (VTRE), the country's main refiner and Blackstone's partner in the project.The proposed restart of Dong Pao - whose timeline, scale and degree of foreign financial support have not been reported previously - comes as many nations fret about their vulnerability to supply disruptions due to China's stranglehold on strategic minerals and its disputes with the U.S. and its allies. Beijing this year imposed export curbs on minor metals used in semiconductors, which an influential Chinese policy adviser warned was ""just a start"".Vietnam has the second-largest rare-earth deposits, according to the U.S. Geological Survey. But they have remained largely untapped, with investment discouraged by low prices that are effectively set by China because of its near-monopoly on the global market. Visiting Hanoi this month to upgrade bilateral relations, U.S. President Joe Biden signed an agreement to boost Vietnam's ability to lure investors for its rare-earth reserves.In interviews with Reuters, 12 industry executives, investors, analysts and foreign officials described plans for Vietnam, including investments they said showed how talk of derisking supply chains to reduce reliance on China is translating into action. Some acknowledged the difficulties of forging a rare-earths hub but said the gambit could make Vietnam a viable player while assuaging strategic worries, even if China remained dominant.Kutscher said Blackstone's investment in the project would be worth around $100 million if it wins. She added that the company was talking to potential clients, including electric car makers VinFast (NASDAQ:VFS) and Rivian (NASDAQ:RIVN), about possible contracts with set prices that would shield suppliers from fluctuations and guarantee buyers a secure supply chain.Sealing such deals would address a hurdle faced by developers in Vietnam. In recent years, Japanese investors  Toyota  (NYSE:TM) Tsusho and Sojitz abandoned projects at Dong Pao after China ramped up supply, pummelling prices. The Japanese firms did not respond to requests for comment.Yet despite the focus on derisking, it is unclear whether clients would be ready to pay a premium for Vietnam, said Dylan Kelly, of investment firm Terra Capital, noting the market in general was opaque.Asked about VinFast's potential involvement, a spokesperson for parent company Vingroup said the group's entity in charge of raw-material procurement, VinES, had no current plans with Blackstone involving rare earths. He did not address subsequent questions about VinFast specifically.Rivian did not reply to a request for comment.RIVALLING MOUNTAIN PASSEffective exploitation of Dong Pao - which has sat dormant for at least seven years, according to an official at state-controlled miner Lavreco, which owns a concession - would propel Vietnam into the top league of rare-earths producers.But refining rare earths is complex, and China controls many processing technologies. Dong Pao's estimated deposits also need to be reassessed with modern methods, according to Blackstone.Still, rare earths at Dong Pao are relatively easy to access and are mostly concentrated in bastnaesite ores, according to the Hanoi University of Mining and Geology. These are typically rich in cerium, used in flat screens, and lanthanides, such as praseodymium and neodymium, which go into magnets.Tuan said VTRE hoped to win a concession that would allow it to extract about 10,000 metric tons of rare-earth oxide (REO) equivalent a year, roughly one-third of the mine's expected annual output. Production could start around the end of 2024, he said.That would put Dong Pao's output slightly below that of California's Mountain Pass, one of the world's largest mines, which produced 43,000 metric tons of REO equivalent in 2022, according to the USGS.Vietnam also plans to develop additional mines. In July, Hanoi set a target to produce up to 60,000 tons of REO equivalent a year by 2030. China set a domestic quota of 210,000 tons last year.Those goals would see Vietnam producing 5% to 15% of China's projected output by the decade's end, said David Merriman, a research analyst at consultancy Project Blue, who expects China to increase production over that period. Vietnam's targets were ""ambitious, though they are not entirely out of the question"", he said.U.S. ENCOURAGEMENT The U.S. agreed during Biden's visit to help Vietnam better map its rare-earths resources and ""attract quality investment"", according to a White House fact sheet, a move that could encourage U.S. investors to bid for Vietnam's new concessions.Reuters could not determine whether concrete plans involving U.S. investors exist at this stage. Officials at the U.S. embassy in Hanoi, the White House and Department of Commerce did not reply to requests for comment. But recent U.S. attempts to gain a foothold in the Vietnamese industry did not succeed, said John Rockhold, a consultant to the rare-earths sector and president of the Hanoi chapter of the U.S. Chamber of Commerce, adding that one such plan involving VTRE collapsed this year. That plan would have involved the shipment to the U.S. of rare earths refined by VTRE and possible future investment in Vietnam of $200 million, according to a non-public report for unspecified U.S. investors seen by Reuters. VTRE confirmed the shipment deal had foundered.Instead, VTRE in April announced a deal to supply 100 metric tons of rare-earth oxides this year to Australian Strategic Materials. ASM declined to comment on Dong Pao's exploitation.Blackstone, which is a partner in that deal, operates a nickel mine in Vietnam and has determined that its processing facility in the country could handle ore from Dong Pao, according to a company statement.FROM ORE TO MAGNETUltimately, VTRE plans to play a role in the whole rare-earth industry from ore extraction to the final products, said Tuan, who with his wife owns most VTRE shares, according to a list of shareholders he showed to Reuters. Blackstone said the ownership information accorded with its assessment following due diligence.This is not an easy feat. The U.S. currently exports its rare-earth ores to China for processing as it lacks its own facilities.An existing VTRE factory in northern Vietnam specialises in separating rare-earth oxides from the extracted ore. The plant has capacity to process 5,000 tons of REO a year but the company plans to treble that to accommodate input from Dong Pao, Tuan said.Once separated, oxides are turned into metals for use in magnets and other industrial applications. The metallization process is controlled by China, which produces 90% of rare-earth metals, according to the U.S. Department of Energy.But VTRE is running a pilot project to build a metallization factory with South Korea's Setopia, said Setopia, which has no previous experience in the sector.The initial combined investment would be around $4 million, mostly from Setopia, a Setopia official told Reuters, with a plant possibly ready next year.In the downstream industry, South Korean and Chinese magnet firms are set to open factories in Vietnam, Reuters reported in August.Dudley Kingsnorth, a professor at the Western Australian School of Mines at Curtin University, said Vietnam had some way to go, including in improving environmental practices, to realise its rare-earth goals.Still, he said, Vietnam ""has the resources, the mining and processing expertise to provide alternatives to China"".  
",https://www.investing.com/news/stock-market-news/inside-vietnams-plans-to-dent-chinas-rare-earths-dominance-3181282
41,Tesla's Saudi Arabia expansion rumors dispelled by Musk: This week in EVs By Investing.com,"Published Sep 24, 2023 04:02AM ET","Position added successfully to: 
Investing.com -- Here is your weekly Pro Recap of the past week's biggest headlines in the electric vehicle space: Elon Musk claims WSJ report ‘utterly false’; VinFast posts impressive results; and EVs are taking over EU.Get news like this in real time by signing up for InvestingPro.Conflicting reports have emerged this week regarding Tesla's (NASDAQ:TSLA) potential expansion plans in Saudi Arabia. Initially, The Wall Street Journal reported that the EV giant was in preliminary discussions with Arab government about establishing a manufacturing facility in the country. Citing unnamed sources, the report highlighted potential challenges stemming from the complex relationship between Tesla's CEO, Elon Musk, and Saudi officials, as well as Saudi Arabia's existing collaboration with electric vehicle competitor Lucid Group (NASDAQ:LCID).If a deal were to materialize, it could have a significant impact on Tesla's ambitious goal of selling 20 million vehicles annually by 2030, as Elon Musk has previously suggested. This objective might require around twelve additional manufacturing facilities worldwide. Currently, Tesla manufactures vehicles in the United States, China, and Germany, with plans to expand operations into Mexico.However, the story took an unexpected turn when Elon Musk himself took to his social media platform ""X"" to deny The Wall Street Journal's report. Musk dismissed the article as ""another utterly false article from the WSJ.""The Wall Street Journal had based its report on information from unnamed sources who acknowledged that the talks between Tesla and Saudi Arabia were still in their early stages and could potentially fall apart.Shares of TSLA reached a weekly high of $272.13 on Wednesday before ending the week down 8%.As always, InvestingPro subscribers got this news first. Start your 7-day trial to get on board!Vietnamese automaker VinFast Auto (NASDAQ:VFS) is making significant strides. In its first quarterly report since going public in August, Vinfast announced a remarkable 131.2% increase in revenue. The company reported Q2 revenue of 7.95 trillion Vietnamese dong ($327 million) for the period ending on June 30th. This impressive growth can be attributed to a substantial surge in deliveries, with 9,535 vehicles delivered during the second quarter, marking a more than fivefold increase compared to the first quarter. In the first half of the year, Vinfast reported a total of 11,315 deliveries, showcasing its expanding presence in the electric vehicle market.Despite a history of losses, Vinfast achieved a valuation of approximately $85 billion upon its Wall Street debut, surpassing the valuations of U.S. automakers Ford (NYSE:F) and General Motors (NYSE:GM). This valuation surge was fueled by increased delivery volume and reductions in research and development expenses, leading to a reduction in net loss from 13.65 trillion Vietnamese dong to 12.54 trillion Vietnamese dong.Additionally, Vinfast CEO Thuy Le revealed plans to send the first batch of electric vehicles to Europe later this year, following regulatory approval. Approximately 3,000 VF8 crossover vehicles will be shipped to France, Germany, and the Netherlands during the fourth quarter from VinFast's manufacturing facility in northern Vietnam.This marks a significant expansion, surpassing their previous target of delivering 700 vehicles by July of the previous year. The move into the European market is strategically timed, given the European Union's investigation into Chinese electric vehicle manufacturers, potentially creating an opening for Vinfast.Shares of VFS ended the week down 3% to $15.63/sh.EVs made significant strides in the European market in August, with data released by the European Automobile Manufacturers Association (ACEA) revealing that slightly over 20% of all new cars purchased in the European Union were fully electric. This marked the first instance where EVs constituted more than a fifth of total sales, with close to 1 million fully-electric vehicles sold in the EU over the initial eight months of 2023.Volkswagen (OTC:VLKAF), Europe's leading car manufacturer, reported a notable 21.2% increase in sales for August, according to the ACEA. Stellantis (NYSE:STLA) and Renault (OTC:RNLSY) also experienced sales growth, with increases of 6.4% and 22.3%, respectively.",https://www.investing.com/news/stock-market-news/teslas-saudi-arabia-expansion-rumors-dispelled-by-musk-this-week-in-evs-3181199#comments
