,title,date,content,link
13,"'Power, influence, notoriety': The Gen-Z hackers who struck MGM, Caesars By Reuters","Published Sep 22, 2023 06:09AM ETUpdated Sep 22, 2023 05:02PM ET","Position added successfully to: 
Position added successfully to: 
Position added successfully to: 
Position added successfully to: 
Position added successfully to: 
By Zeba Siddiqui and Raphael SatterSAN FRANCISCO/WASHINGTON (Reuters) - About a year ago, the U.S. security firm Palo Alto Networks (NASDAQ:PANW) began to hear from a flurry of companies that had been hacked in ways that weren't the norm for cybercriminals. Native English-speaking hackers would call up a target company’s information technology helpdesk posing as an employee, and seek login details by pretending to have lost theirs. They had all the employee information needed to sound convincing. And once they got access, they’d quickly find their way into the company's most sensitive repositories to steal that data for extortion.Ransomware attacks are not new, but this group was extraordinarily skilled at social engineering and bypassing multi-factor authentication, said Wendi Whitmore, senior vice president for the security firm Palo Alto Networks' Unit 42 threat intelligence team, which has responded to several intrusions tied to the group.""They are much more sophisticated than many cybercriminal actors. They appear to be disciplined and organized in their attacks,"" she said. ""And that's something we typically see more frequently with nation-state actors, versus cyber criminals.""Known in the security industry variously as Scattered Spider, Muddled Libra, and UNC3944, these hackers were thrust into the limelight earlier this month for breaching the systems of two of the world's largest gambling companies - MGM Resorts (NYSE:MGM) and Caesars (NASDAQ:CZR) Entertainment Ltd.Behind the scenes, it has hit many more companies, according to analysts tracking the intrusions - and cybersecurity specialists expect the attacks to continue. The FBI is investigating the MGM and Caesars breaches, and the companies did not comment on who may be behind them.From Canada to Japan, the security firm CrowdStrike (NASDAQ:CRWD) has tracked 52 attacks globally by the group since March 2022, most of them in the United States, said Adam Meyers, senior vice president of threat intelligence at the company. Google-owned intelligence firm Mandiant, has logged more than 100 intrusions by it in the last two years. Nearly every industry, from telecommunications to finance, hospitality, and media, has been hit. Reuters was not able to determine how much money the hackers may have extorted.But it's not just the scale or the breadth of attacks that make this group stand out. They're extremely good at what they do and ""ruthless"" in their interactions with victims, said Kevin Mandia, Mandiant's founder.The speed at which they breach and exfiltrate data from company systems can overwhelm security response teams, and they have left threatening notes for staff of victim organizations on their systems, and contacted them by text and email in the past, Mandiant found.In some cases - Mandia did not say which ones - hackers tied to Scattered Spider placed bogus emergency calls to summon heavily armed police units to the homes of executives of targeted companies. The technique, called SWATing, ""is something that’s utterly dreadful to live through as a victim,"" he said. ""I don’t even think these intrusions are about money. I think they’re about power, influence and notoriety. That makes it harder to respond to.""Reuters couldn't immediately reach the hacking group for comment. 17-22 YEAR OLDS There's little detail on Scattered Spider's location or identity. Based on the criminals’ chats with victims and clues gleaned from breach investigations, CrowdStrike's Meyers said they are largely 17-22 years-olds. Mandiant estimates they’re mainly from Western countries, but it's unclear how many people are involved. Before calling helpdesks, the hackers acquire employee information including passwords by social engineering, especially 'SIM swapping' - a technique where they trick a telecom company's customer service representative to reassign a specific phone number from one device to another, analysts say.They also appear to make the effort to study how large organizations work, including their vendors and contractors, to find individuals with privileged access they can target, according to analysts. That’s something David Bradbury, chief security officer of the identity management firm Okta (NASDAQ:OKTA), saw first-hand last month, when he discovered multiple Okta customers – including MGM – breached by Scattered Spider. Okta provides identity services such as multi-factor authentication used to help users securely access online applications and websites.""The threat actors have clearly taken our courses that we provide online, they've clearly studied our product and how it works,"" Bradbury said. ""This is stuff we haven't seen before."" A larger group named ALPHV said last week it was behind the MGM hack, and analysts believe it provided the software and attack tools for the operation to be carried out by Scattered Spider. Such collaborations are typical for cybercriminals, said Okta's Bradbury. ALPHV, which according to Mandiant is a ""ransomware-as-a-service"", would provide services such as a helpdesk, webpage and branding, and in turn get a cut of whatever Scattered Spider would make from the hack. While many ransomware attacks go unpublicised, the MGM hack was a vivid example of the real-world impact of such incidents. It caused chaos in Las Vegas, as gaming machines stalled and hotel systems were disrupted. Ransomware gangs often function like large organizations, and continue to evolve their methods to adapt to the latest security measures organizations use. ""In some ways this is just like the age-old game of cat and mouse,"" said Whitmore, who compared Scattered Spider to Lapsus$, another group behind previous hacks into Okta and the technology giant Microsoft (NASDAQ:MSFT). The British police last year arrested seven people between the ages of 16 and 21 following those hacks.  
",https://www.investing.com/news/stock-market-news/power-influence-notoriety-the-genz-hackers-who-struck-mgm-caesars-3180473
14,Brookfield cancels share conversion due to insufficient tenders By Investing.com,"Published Sep 22, 2023 05:17PM ET","Brookfield Corporation (NYSE: BN, TSX: BN) announced on Friday that the proposed conversion of its Cumulative Class A Preference Shares, Series 32 (TSX: BN.PF.A) into Cumulative Class A Preference Shares, Series 33 will not proceed. The decision comes after the company received fewer election notices than required for the conversion.The corporation reported that only 177,688 Series 32 Shares were tendered for conversion, falling short of the one million shares needed to effect the change to Series 33 Shares. As a result, there will be no conversion, and holders of Series 32 Shares will retain their existing shares.Brookfield Corporation is a long-term capital compounding entity that aims to provide attractive total returns for its shareholders. The corporation's assets are currently deployed across three businesses - Asset Management, Insurance Solutions, and Operating Businesses. These ventures generate substantial and increasing free cash flows, backed by a cautiously capitalized balance sheet.This article was generated with the support of AI and reviewed by an editor. For more information see our T&C.",https://www.investing.com/news/stock-market-news/brookfield-cancels-share-conversion-due-to-insufficient-tenders-93CH-3180924
15,"X social media's India, South Asia policy head Gupta resigns-sources By Reuters","Published Sep 23, 2023 01:16AM ETUpdated Sep 23, 2023 06:10AM ET","By Aditya KalraNEW DELHI (Reuters) - Social media platform X's head of policy for India and South Asia, Samiran Gupta, has resigned, two sources said, a top departure that comes ahead of India elections and as the company fights a court battle with New Delhi over content removal.Gupta was the most senior India employee for X, formerly known as Twitter, and responsible for ""key content-related policy issues"" and ""defending Twitter's position with new policy developments and support in-country sales organization,"" according to his LinkedIn profile.Gupta, who was designated as X's Head of Global Government Affairs for India and South Asia, declined to comment to Reuters. X did not immediately respond to a request for comment.Gupta's tenure at X ended in September, according to Gupta's LinkedIn profile, which said he ""enabled transition leadership for Twitter post acquisition by Elon Musk led X-Corp."" He had joined the company in February, 2022, eight months before Musk completed his $44 billion acquisition of  Twitter Inc  (NYSE:TWTR). X counts India as a key market, with around 27 million users. Prime Minister Narendra Modi and other government officials are regular users of the platform.There are roughly 15 X employees in functions like compliance and engineering in India, said one of the sources, but Gupta was the only executive engaging with the government and political parties.Interaction between X and government and party officials would intensify typically during the run up to polls, and a national election is due to take place in India next year.X is appealing against an Indian court ruling that it had failed to comply with government orders to remove certain content, arguing it could embolden New Delhi to block more content and broaden the scope for censorship.India in September told a court X is a ""habitual non-compliant platform"" and for years has not followed many orders to remove content, undermining the government's role.  
",https://www.investing.com/news/stock-market-news/x-social-medias-india-south-asia-policy-head-gupta-resignssources-3180968
16,Explainer-What you need to know about RSV and the new vaccines By Reuters,"Published Sep 22, 2023 02:18PM ETUpdated Sep 22, 2023 05:33PM ET","Position added successfully to: 
By Michael Erman(Reuters) -The U.S. Centers for Disease Control and Prevention (CDC) on Friday recommended  Pfizer  (NYSE:PFE)'s respiratory syncytial virus (RSV) vaccine for women in the middle of the third trimester of pregnancy to protect their babies from severe illness.That Pfizer shot and one developed by GSK in May became the first two RSV vaccines to win U.S. approval, for use in people aged 60 and over to prevent severe illness. In August, Pfizer's vaccine also won approval for the maternal use. Here's what you need to know. What is RSV? RSV is a usually seasonal respiratory virus that generally causes mild, cold-like symptoms. Still, infants and older adults have a higher risk of developing severe RSV.RSV leads to 58,000 to 80,000 hospitalizations among children under age 5, and 60,000 to 160,000 hospitalizations among adults age 65 and older each year, according to the CDC. It causes around 14,000 deaths in adults aged 65 and older in the U.S. annually, according to government estimates. Who should get the vaccines?The U.S. CDC has recommended that adults aged 60 or older may get the shot after discussions with a healthcare provider about whether RSV vaccination is right for them. The agency stopped short of saying all adults over the age of 60 should receive it this year.Outside advisers to the CDC suggested the narrower recommendation in June after expressing concern that there was not sufficient data on how effective the vaccines are in people over age 75 and in other high-risk groups.CDC Director Dr. Mandy Cohen formally recommended use of the vaccine in expecting mothers to protect infants up to age 6 months after the agency's Advisory Committee on Immunization Practices voted 11-1 in its favor. The panel recommended use of the shot in women 32 weeks to 36 weeks into their pregnancy from September to January, in order to protect babies born in peak RSV season.How often do I need to get the vaccine to stay protected?Early data suggests that the RSV shots are protective for at least two years, but it is not yet clear how often older adults will need to be revaccinated. CDC advisers will consider the frequency of revaccination when more data becomes available.What else is available to protect infants from RSV?In July, the FDA also approved Beyfortus, a long-acting antibody therapy from  Sanofi  (NASDAQ:SNY) and partner AstraZeneca (NASDAQ:AZN), to prevent RSV in children up to 24 months of age.Previously, Swedish Orphan Biovitrum's Synagis was the only approved preventive therapy in the U.S. for high-risk infants. Synagis is given as monthly injections, while Beyfortus can be given annually.Are RSV cases on the rise?Yes, although not alarmingly so. Detection of the virus in testing has increased significantly over the last month to around the same levels as this spring, according to CDC data. Still, that is a fraction of the positive tests recorded at the same time a year ago, when RSV cases were surging around the country and hospitals were running out of pediatric beds.Can I get the RSV shot alongside my COVID and flu shots?Yes, current CDC guidelines allow for all three vaccines to be administered simultaneously, even though they have not been tested together.""If it's now or never again, it's best to get all the vaccines you're eligible for to get the protection against as many diseases as possible,"" said Dr. Jeffrey Duchin, a member of the board of directors for the Infectious Diseases Society of America. ""If you've got the luxury of returning for more than one visit, you can choose to space them out."" Will my insurance cover it?Adults who are insured under the U.S. Medicare program for people aged 65 and older or disabled are covered for the vaccine. Many private insurance plans, including large insurers like CVS Health (NYSE:CVS)'s Aetna, Humana (NYSE:HUM) and Elevance, which owns Blue Cross Blue Shield insurers including Anthem, also say they are covering the shot for adults 60 and older who are not yet eligible for Medicare. Typically you do not need a prescription.Keep up with the latest medical breakthroughs and healthcare trends with our newsletter Reuters Health Rounds. Sign up here. 
",https://www.investing.com/news/stock-market-news/explainerwhat-you-need-to-know-about-rsv-and-the-new-vaccines-3180827
17,US Supreme Court extends pause on order curbing Biden social media contacts By Reuters,"Published Sep 22, 2023 04:28PM ETUpdated Sep 22, 2023 05:05PM ET","By Nate Raymond and Andrew Chung(Reuters) - U.S. Supreme Court Justice Samuel Alito on Friday extended a temporary block on an order restricting the ability of President Joe Biden's administration to encourage social media companies to remove content it deemed misinformation about COVID-19 and other matters of public concern.The decision to keep the matter on hold until Wednesday gives the court more time to consider the administration's request to block an injunction issued by a lower court that had concluded that federal officials likely had violated the free speech protections of the U.S. Constitution's First Amendment by coercing social media platforms into censoring certain posts.Alito's order pauses the dispute until Sept. 27 at 11:59 p.m. EDT. He had previously halted the lower court's rulingthrough Sept. 22. Alito is the justice designated by the court to act on certain matters arising from a group of states that include Louisiana, where the lawsuit was first filed.The Republican attorneys general of Missouri and Louisiana and a group of social media users sued federal officials, accusing them of unlawfully helping suppress conservative-leaning constitutionally protected speech on major social medial platforms.Those platforms included Meta's Facebook (NASDAQ:META), Alphabet (NASDAQ:GOOGL)'s YouTube and X, formerly called Twitter. Many of the posts expressed opinions that federal officials said constituted misinformation about the pandemic.The Biden administration argued that officials did nothing illegal and had sought to mitigate the hazards of online misinformation by alerting social media companies to content that violated their own policies.Louisiana-based U.S. District Judge Terry Doughty in July concluded that government officials had coercively pressured the companies to suppress posts by users that expressed views that were against COVID-19 vaccines, pandemic-related lockdowns intended as public health measures or that questioned the results of the 2020 election in which Biden, a Democrat, defeated Donald Trump, a Republican.The New Orleans-based 5th U.S. Circuit Court of Appeals vacated much of an injunction that Doughty issued restricting the administration's social media communications, with the exception of a provision concerning coercion, which they narrowed.The narrowed injunction applied to the White House, the surgeon general, the U.S. Centers for Disease Control and Prevention and the FBI, saying they could not ""coerce or significantly encourage"" the companies to remove content.The administration told the Supreme Court that the remaining injunction still went too far and would interfere with how the White House, FBI and health officials address matters of public concern and security.  
",https://www.investing.com/news/stock-market-news/us-supreme-court-extends-pause-on-order-curbing-biden-social-media-contacts-3180898
18,Oracle spends more than $100 million on Ampere chips By Reuters,"Published Sep 22, 2023 05:33PM ETUpdated Sep 22, 2023 06:25PM ET","Position added successfully to: 
(Reuters) -Oracle Corp agreed to prepay $104.1 million for processor chips made by startup Ampere Computing, according to Oracle (NYSE:ORCL)'s proxy statement filed on Friday.Oracle also invested $400 million in Ampere through a convertible note in its fiscal 2023, the proxy said.Ampere builds custom server chips based on Arm technology that compete with designs produced by Intel (NASDAQ:INTC) and Advanced Micro Devices (NASDAQ:AMD), which use X86. Oracle has invested hundreds of millions of dollars in Ampere since it was founded, according to filings.The idea behind the investment in Ampere – and its chip purchases - is to give Oracle's cloud an advantage over rivals. Amazon.com (NASDAQ:AMZN) makes its own server chips that compete with Ampere, and Google (NASDAQ:GOOGL) makes its own artificial intelligence processors.Ampere declined to comment. Oracle did not return a request for comment. 
",https://www.investing.com/news/stock-market-news/oracle-spends-more-than-100-million-on-ampere-chips-3180928#comments
19,Asian markets anticipate cautious start amid U.S. Federal Reserve policy implications By Investing.com,"Published Sep 24, 2023 07:05PM ET","Position added successfully to: 
Position added successfully to: 
Position added successfully to: 
Position added successfully to: 
Asian stock markets are preparing for a cautious commencement to the week today, as investors evaluate the potential impact of the U.S. Federal Reserve's policy stance. Japanese futures remained steady on Sunday, while Australian futures and Hong Kong stock contracts experienced slight declines. In contrast, an index of U.S.-listed Chinese companies saw an increase, following the announcement that Washington and Beijing are setting up working groups to discuss economic and financial matters.In early Monday trading in Asia, S&P 500 futures rose by 0.2%, recovering from Friday's equivalent fall that marked its poorest week since March. Nasdaq 100 futures also increased by 0.2%, buoyed by Apple Inc (NASDAQ:AAPL).'s latest product sales which contributed to the stability of the underlying index on Friday.The upcoming week will see U.S. Treasuries once again under scrutiny due to scheduled public appearances by Federal Reserve officials. Investors are also awaiting key U.S. inflation data and assessing the potential implications of a possible U.S. government shutdown.According to market analyst Fawad Razaqzada from City Index and Forex.com, traders remain wary about inflation and policy direction in light of the recent oil surge and the Fed's hint that interest rates will not decrease in the near future.Two Federal Reserve officials suggested last week that at least one more rate hike could be forthcoming, with borrowing costs potentially needing to stay high for a longer period for inflation to return to its 2% target. Boston Fed President Susan Collins did not rule out further tightening, while Governor Michelle Bowman suggested that more than one increase might be necessary, reinforcing her status as one of the Federal Open Market Committee's most hawkish members.San Francisco Fed Bank President Mary Daly stated last week that it is premature to claim victory over inflation, reaffirming the central bank's continued commitment to manage price pressures as smoothly as possible.Bank of America Corp (NYSE:BAC)'s rate strategists predict that the yield on 10-year Treasuries could reach 4.75% before softer risk sentiment and tighter financial conditions drive it down by year-end.In other market news, oil prices are approaching their annual high, while Bitcoin remained steady around $26,500.The week ahead is packed with key events including speeches by Minneapolis Fed President Neel Kashkari and ECB's Francois Villeroy de Galhau on Monday. This will be followed by the release of U.S. new home sales data and Conference Board consumer confidence on Tuesday, with ECB's Philip Lane also scheduled to speak. Other highlights include China's industrial profits data and U.S. durable goods data on Wednesday, Eurozone economic and consumer confidence data on Thursday, and U.S. initial jobless claims and GDP data.This article was generated with the support of AI and reviewed by an editor. For more information see our T&C.",https://www.investing.com/news/stock-market-news/asian-markets-anticipate-cautious-start-amid-us-federal-reserve-policy-implications-93CH-3181268#comments
20,Exclusive-Germany scraps plans for more stringent building standards to prop up industry By Reuters,"Published Sep 24, 2023 06:04PM ET","By Christian KraemerBERLIN (Reuters) - The German government will put on indefinite hold plans to require more stringent building insulation standards, environment minister Robert Habeck told Reuters, an effort to help prop up the ailing building industry.The about-face from the German government comes ahead of a closely watched meeting between the building industry and government leaders with Chancellor Olaf Scholz on Monday to address a major slump in the sector.Abolition of the insulation standards has been a top demand of industry, which says the measures are too expensive and put a further damper on the depressed construction industry.""High interest rates and inflation are a heavy burden for the construction industry,"" Habeck told Reuters, noting that the insulation measures now ""can wait"".""I don't see this new standard being introduced in this legislative period,"" he said. The period runs until late 2025.For years, low interest rates fuelled a global boom, igniting interest in German property, seen as safe and stable as the country. A sharp rise in rates put an end to the run, tipping a string of developers into insolvency as deals froze and prices fell.German housing prices fell by the most since records began in the second quarter, the latest grim sign for the property market in Europe's largest economy, government data showed on Friday.Also last week, data showed that building permits for apartments in Germany fell 31.5% in July from a year earlier, highlighting a slump in demand plaguing the construction and real estate industry.Germany, whose population has recently grown as millions flock to the country, aims to build 400,000 apartments a year, but has struggled.Weakness in commercial real estate in the United States as offices remain empty after the pandemic and the unravelling in Sweden of one of the country's biggest landlords have globally called attention to distress in the sector. China has also seen major property builders struggle.In the weeks ahead of Monday's summit, the industry has been calling on the government for an aid package. Among other measures, industry leaders are asking for an abolition of a sales tax on property transactions and a government-backed credit program to help borrowers offset high interest rates.  
",https://www.investing.com/news/stock-market-news/exclusivegermany-scraps-plans-for-more-stringent-building-standards-to-prop-up-industry-3181262
