,title,date,time,content,link
0,"French centre-right keeps control of Senate, far-right wins three seats | Reuters","September 24, 2023",9:01 PM UTC,"PARIS, Sept 24 (Reuters) - France's centre-right Les Republicains (LR) party maintained its majority in the Senate after Sunday's vote, in which three senators from Marine Le Pen's far-right party were elected.""This senatorial renewal reinforces the senatorial majority of the right and the center and is a testimony of its territorial roots,"" Gerard Larcher, the leader of Les Republicains and president of the senate, said in a statement.The Senate is indirectly elected by France's mayors as well as regional, departmental and municipal councillors. Half of the Senate's 348 seats were being contested.Le Pen's Rassemblement National had been widely expected to make a new breakthrough in the Senate but the score of three wins was above expectations.The election of far-right senators is mostly a delayed reflection of strong results by Le Pen's party in previous local elections and does not necessarily predict her results in the next elections.The only member of the French government running in the elections, Secretary of State for Citizenship Sonia Backes, was defeated in the French territory of New Caledonia.Under France's Fifth Republic, the Senate has less influence over legislating than the National Assembly, the lower house of parliament. In case of disagreement over legislation, it is the Assembly which has the last word.French President Emmanuel Macron's Renaissance party remains the biggest party in the lower house, but lost its majority in June last year, giving more weight to senators whenever a compromise is necessary with the upper house to pass legislation.Macron has struggled to anchor his party at a local level, with local authorities mostly controlled by France's historically dominant political forces, the conservative LR and the left-wing Socialist party.",https://www.reuters.com/article/france-politics/french-centre-right-keeps-control-of-senate-far-right-wins-3-seats-idUSKBN30U0E3
1,Armenian PM blames Russia for failing to ensure security | Reuters,"September 24, 2023",4:48 PM UTC,"MOSCOW, Sept 24 (Reuters) - Armenia's Prime Minister Nikol Pashinyan said on Sunday the likelihood was rising that ethnic Armenians would flee the breakaway region of Nagorno-Karabakh and blamed Russia for failing to ensure Armenian security.If 120,000 people go down the Lachin corridor to Armenia, the small South Caucasian country could face both a humanitarian and political crisis.""If proper conditions are not created for the Armenians of Nagorno-Karabakh to live in their homes and there are no effective protection mechanisms against ethnic cleansing, the likelihood is rising that the Armenians of Nagorno-Karabakh will see exile from their homeland as the only way to save their lives and identity,"" Pashinyan said in address to the nation.""Responsibility for such a development of events will fall entirely on Azerbaijan, which adopted a policy of ethnic cleansing, and on the Russian peacekeeping contingent in Nagorno-Karabakh,"" he said, according to a government transcript.He added that the Armenian-Russian strategic partnership was ""not enough to ensure the external security of Armenia"".Last week, Azerbaijan scored a victory over ethnic Armenians who have controlled the Karabakh region since the dissolution of the Soviet Union. An adviser to the leader of the Karabakh Armenians told Reuters earlier on Sunday that the population would leave because they feel unsafe under Azerbaijani rule.Russia had acted as guarantor for a peace deal that ended a 44-day war in Karabakh three years ago, and many Armenians blame Moscow for failing to protect the region.Russian officials say Pashinyan is to blame for his own mishandling of the crisis, and have repeatedly said that Armenia, which borders Turkey, Iran, Azerbaijan and Georgia, has few other friends in the region.""The government will accept our brothers and sisters from Nagorno-Karabakh with full care,"" Pashinyan said.Pashinyan has warned that some unidentified forces were seeking to stoke a coup against him and has accused Russian media of engaging in an information war against him.""Some of our partners are increasingly making efforts to expose our security vulnerabilities, putting at risk not only our external, but also internal security and stability, while violating all norms of etiquette and correctness in diplomatic and interstate relations, including obligations assumed under treaties,"" Pashinyan said in his Sunday address.""In this context, it is necessary to transform, complement and enrich the external and internal security instruments of the Republic of Armenia,"" he said.",https://www.reuters.com/article/armenia-azerbaijan-pashinyan/armenian-pm-says-armenians-may-flee-karabakh-and-blames-russia-idUSKBN30U03R
2,Canada House speaker apologizes for recognition of veteran who fought for Nazis | Reuters,"September 25, 2023",12:49 AM UTC,"WASHINGTON, Sept 24 (Reuters) - The speaker of Canada's House of Commons on Sunday apologized for praising an individual at a parliamentary meeting who served in a Nazi unit during World War Two.Two days earlier, Speaker Anthony Rota had recognized 98-year old Yaroslav Hunka as a ""Ukrainian hero"" before the Canadian Parliament. Hunka served in World War II as a member of the 14th Waffen Grenadier Division of the SS, according to the Friends of Simon Wiesenthal Center, a Jewish human rights group that demanded an apology.Rota in a statement took responsibility for what was characterized as an oversight, calling the initiative ""entirely my own.""""I have subsequently become aware of more information which causes me to regret my decision,"" he said, adding his ""deepest apologies"" to Jewish communities.The recognition came following a visit by Ukrainian President Volodymyr Zelenskiy, who thanked Canada for its assistance in his country's war against Russia.Following Zelenskiy's remarks, Rota acknowledged Hunka, who was seated in the gallery, praising him for fighting for Ukrainian independence against the Russians. Hunka received two standing ovations from those gathered.""At a time of rising antisemitism and Holocaust distortion, it is incredibly disturbing to see Canada's Parliament rise to applaud an individual who was a member of a unit in the Waffen-SS, a Nazi military branch responsible for the murder of Jews and others,"" the Friends of Simon Wiesenthal Center said in a statement while demanding an apology earlier Sunday.""An explanation must be provided as to how this individual entered the hallowed halls of Canadian Parliament and received recognition from the Speaker of the House and a standing ovation,"" the group added.Russia's RIA state news agency cited Russia's ambassador to Canada, Oleg Stepanov, as saying that the embassy will sent a letter to Prime Minister Justin Trudeau and a note to the Canadian foreign ministry on Monday.""We will, of course, demand clarification from the Canadian government,"" RIA cited Stepanov as saying.Russia launched a full-scale invasion on Ukraine in February 2022, saying the goal of the ""special military operation"" was to de-nazify and demilitarize its neighbour.Kyiv and its Western allies, say the aggression, which has since seen thousands killed and millions displaced, has been an unprovoked land grab. Washington has said that Moscow's false justification for the war has been nothing but the Kremlin's attempt to ""manipulate international public opinion.""Rota added in his statement that no one, including fellow parliamentarians or the Ukrainian delegation, was aware of his plans or remarks beforehand.Hunka could not be reached for comment.",https://www.reuters.com/article/ukraine-crisis-canada-zelenskiy/canada-house-speaker-apologizes-for-recognition-of-veteran-who-fought-for-nazis-idUSKBN30U0GX
3,Capsule with NASA's first asteroid sample heads for Utah touchdown | Reuters,"September 24, 2023",3:20 PM UTC,"Sept 24 (Reuters) - A NASA capsule carrying the largest soil sample ever collected from an asteroid is due to return to Earth on Sunday, expected to streak through the atmosphere and parachute into the Utah desert to deliver its celestial specimen to scientists.The robotic spacecraft OSIRIS-REx is scheduled to release the gumdrop-shaped capsule, transporting about a cup of gravelly asteroid material, at 6:42 a.m. EDT (1042 GMT) for a final descent to Earth, climaxing a seven-year voyage.Plans call for the capsule to touch down a little more than four hours later within a 250-square-mile (650-sq-km) landing zone west of Salt Lake City on the U.S. military's vast Utah Test and Training Range.Success of the mission, a joint effort between NASA and the University of Arizona, would mark the third asteroid sample, and by far the biggest, ever returned to Earth for analysis, following two similar missions by Japan's space agency ending in 2010 and 2020.OSIRIS-REx collected its specimen from Bennu, a small, carbon-rich asteroid discovered in 1999 and classified as a ""near-Earth object"" because it passes relatively close to our planet every six years, though the odds of an impact are considered remote.Apparently made up of a loose collection of rocks, like a rubble pile, Bennu measures just 500 meters (1,600 ft) across, making it slightly wider than the Empire State Building is tall but tiny compared with the Chicxulub asteroid that struck Earth some 66 million years ago, wiping out the dinosaurs.Like other asteroids, Bennu is a relic of the early solar system. Because its present-day chemistry and mineralogy are virtually unchanged since forming some 4.5 billion years ago, it holds valuable clues to the origins and development of rocky planets such as Earth.It may even contain organic molecules similar to those necessary for the emergence of microbes.Samples returned three years ago by the Japanese mission Hayabusa2 from Ryugu, another near-Earth asteroid, were found to contain two organic compounds, buttressing the hypothesis that celestial objects such as comets, asteroids and meteorites that bombarded early Earth seeded the young planet with the primordial ingredients for life.OSIRIS-REx launched in September 2016 and reached Bennu in 2018, then spent nearly two years orbiting the asteroid before venturing close enough to snatch a sample of the loose surface material with its robot arm on Oct. 20, 2020.The spacecraft departed Bennu in May 2021 for a 1.2-billion-mile (1.9-billion-km) cruise back to Earth, including two orbits around the sun. If mission control commands the release of the sample-return capsule as planned, it will be jettisoned within 67,000 miles of Earth for the final leg of its return flight.Hitting the upper atmosphere at 35 times the speed of sound, the capsule is expected to glow red hot as it plunges earthward and temperatures inside the vessel peak at 5,000 degrees Fahrenheit (2,800°C).Parachutes are designed to deploy near the very end of the descent, slowing the capsule to about 11 mph before it falls gently onto the desert floor of northwestern Utah.The Bennu sample is estimated at 250 grams (8.8 ounces), far surpassing the 5 grams of material carried back from Ryugu in 2020 or the tiny specimen delivered from asteroid Itokawa in 2010.Scientists hope the integrity of the capsule and inner cannister bearing the asteroid material will be maintained through re-entry and landing, keeping the sample pristine and free of any terrestrial contamination.On arrival, the sample will be flown by helicopter to a ""clean room"" at the Utah test range for initial examination, then transported to NASA's Johnson Space Center in Houston, to be parceled into smaller specimens promised to some 200 scientists in 60 laboratories around the world.The main portion of the OSIRIS-REx spacecraft, meanwhile, is expected to sail on to explore yet another near-Earth asteroid, named Apophis.",https://www.reuters.com/article/space-exploration-asteroid/nasa-asteroid-sample-parachutes-safely-onto-utah-desert-idUSKBN30U01Y
4,Asia Olympic body backs North Korea flag at Hangzhou despite WADA ban | Reuters,"September 24, 2023",4:22 PM UTC,"HANGZHOU, China, Sept 24 (Reuters) - The Olympic Council of Asia (OCA) said it was happy for the North Korea flag to keep flying at the Hangzhou Asian Games despite it being banned over the country's non-compliance with global anti-doping rules.The World Anti-Doping Agency (WADA) banned the flag at all major sporting events, outside the Olympic and Paralympic Games, in 2021 after deeming that North Korea had failed to implement an effective testing programme.But North Korean athletes marched proudly behind the flag at Saturday's opening ceremony in Hangzhou and it has been displayed at competitions and in the athletes' village.Acting OCA President Randhir Singh said Asian Games organisers and North Korea were in discussions with WADA but that the flag was still flying.""North Korea also has written to WADA as well, explaining their position,"" he told reporters on Sunday.""We are explaining it from our side as well. At present the North Korea flag is flying and we will look into it and see what the future says.""Let me tell you, our intention is that everyone should participate and everyone should have the opportunity to participate.""And if there are certain issues that happen through this pandemic and that period, so we should consider that, take it into account.""WADA said North Korea was still non-compliant with its anti-doping code and the OCA had failed to enforce its sanction.""As such after the opening ceremony, WADA wrote to the OCA to remind them of their obligations and to inform them that a compliance procedure would be opened against them as appropriate,"" the anti-doping body said in a statement.The Hangzhou Asian Games is the first international multi-sport event North Korea is attending since the 2018 edition in Jakarta.North Korea was suspended from the International Olympic Committee (IOC) until the end of 2022, missing last year's Beijing Winter Games, after failing to send a team to the Summer Olympics in Tokyo.The Asian Games was originally due to host up to 500 athletes from Russia and Belarus, despite widespread competition bans for the countries' athletes following Russia's invasion of Ukraine, which Moscow calls a ""special military operation"".However, the IOC confirmed in the lead-up to Hangzhou that they would not participate due to ""logistical"" issues.Singh said the athletes would have ""otherwise been most welcome"" and left the door open for them to participate at future Asian competitions.",https://www.reuters.com/article/games-asia-northkorea/games-asia-olympic-body-backs-north-korea-flag-at-hangzhou-despite-wada-ban-idUSKBN30U04F
5,"Taiwan expects to deploy two new submarines by 2027, security adviser says | Reuters","September 25, 2023",12:03 AM UTC,"TAIPEI, Sept 25 (Reuters) - Taiwan hopes to deploy at least two new, domestically developed submarines by 2027, and possibly equip later models with missiles, to strengthen deterrence against the Chinese navy and protect key supply lines, the head of the program said.Taiwan, which China claims as its own territory, has made the indigenous sub program a key part of an ambitious project to modernise its armed forces as Beijing stages almost daily military exercises to assert its sovereignty.President Tsai Ing-wen, who initiated the program when she took office in 2016, is expected to launch the first of eight new submarines on Thursday under a plan that has drawn on expertise and technology from several countries - a breakthrough for diplomatically isolated Taiwan.Admiral Huang Shu-kuang, Tsai's security adviser, who is leading the program, said a fleet of 10 submarines - which includes two Dutch-made submarines commissioned in the 1980s - will make it harder for the Chinese navy to project power into the Pacific.""If we can build up this combat capacity, I don't think we will lose a war,"" Huang this month told an internal briefing on the project, which was attended by Reuters.Huang said the first submarine, with a price tag of T$49.36 billion ($1.54 billion), will use a combat system by Lockheed Martin Corp (LMT.N) and carry U.S.-made MK-48 heavyweight torpedoes. It will enter sea trials next month before delivery to the navy by the end of 2024.For subsequent models, Taiwan will leave space for submarine-launched anti-ship missiles, but adding those weapons depends on production availability in a U.S., where capacity was already tight, Huang said, without naming the companies that might be involved.He called the submarines a ""strategic deterrent"" to Chinese warships crossing the Miyako Strait near southwestern Japan or the Bashi Channel that separates Taiwan from the Philippines.Huang said Taiwan's diesel-electric submarines can keep China at bay within the first island chain, referring to the area that runs from Japan through Taiwan, the Philippines and on to Borneo, enclosing China's coastal seas.""This was also the strategic concept of the U.S. military - to contain them within the first island chain and deny their access,"" Huang said. ""If Taiwan is taken, Japan will definitely not be safe, South Korea will definitely not be safe.""China's defence ministry did not respond to a request for comment.The Chinese navy, including its Shandong aircraft carrier, has become increasingly active in recent months off Taiwan's eastern coastline, prompting worries that China could launch an attack from that direction. Eastern Taiwan is where planners have long envisioned the island's military regrouping and preserving its forces during a conflict.Huang said the submarines can help maintain the island's ""lifeline"" to the Pacific by keeping ports along Taiwan's eastern coast open for supplies in a conflict.""The submarines will keep their ships away from our eastern shores,"" he said.Chieh Chung, a military researcher at Taiwan's National Policy Foundation think tank, said the fleet would have trouble with that task, because China could position warships in the Pacific before launching an attack.But he added that the submarines could occupy strategic ambush points in the region and ""greatly harm (China's) combat ability"" by targeting high-value ships such as carrier groups or landing fleets.Taiwan has quietly sourced technology, components and talent from at least seven nations to help it build submarines, a Reuters investigation has found.Getting foreign assistance was particularly challenging for Taiwan, which doesn't have official ties with most countries.Huang declined to say which countries had approved export permits, but said he had reached out to generals from countries that included the United States, Japan, South Korea and India.""For those foreign generals who agreed with my ideas, they helped convey the message to their governments or arrange meetings,"" he said. ""I told them our needs and that's how we achieved our purpose of securing export permits.""Huang also expressed thanks for the ""great help"" from a team led by an unnamed retired rear admiral of Britain's Royal Navy, who secured export permits from Britain through a Gibraltar-based company.Britain sharply increased the amount of submarine parts and technology exports approved last year for Taiwan, a Reuters analysis of the data showed.Huang described the program as ""even harder than reaching the sky,"" pointing to challenges such as a global chip shortage that hit many manufacturers around the world. He said his team scrambled to source chips from Taiwan to avoid delays by foreign vendors.A foreign supplier had also pull out at the last minute after the work with Taiwan was leaked to a Chinese embassy, he said, without elaborating.He said China's frequent military harassment, including close approaches to Taiwan's territorial waters and airspace, has prompted Taiwan and the United States to rethink the island's ""asymmetrical"" strategy of making its forces more mobile and harder to attack, with a focus on smaller weapons systems.""The American thinking is changing gradually. They realised that you can't withstand (the harassment) without bigger boats,"" Huang said, pointing to the navy's plan to build a new generation of bigger frigates.""They are getting closer and closer,"" he added, referring to China. ""Taiwan can't drive them out with small boats. We must use bigger boats.""($1 = 31.9840 Taiwan dollars)",https://www.reuters.com/article/taiwan-defence-submarine/taiwan-expects-to-deploy-two-new-submarines-by-2027-security-adviser-idUSKBN30V005
6,Turkey's Erdogan to meet Azeri's Aliyev as thousands flee Karabakh | Reuters,"September 25, 2023",3:04 AM UTC,"Sept 25 (Reuters) - Turkish President Tayyip Erdogan is to meet his ally Azeri President Ilham Aliyev on Monday, as thousands of ethnic Armenians began an exodus from Nagorno-Karabakh after Azerbaijan defeated the breakaway region's fighters last week.Erdogan will pay a one-day visit to Azerbaijan's autonomous Nakhchivan exclave - a strip of Azeri territory nestled between Armenia, Iran and Turkey - to discuss with Aliyev the situation in the Karabakh region, the Turkish president's office said.The Armenians of Karabakh, a territory internationally recognised as part of Azerbaijan but previously beyond its control, were forced into a ceasefire last week after a 24-hour military operation by the much-larger Azerbaijani military.On Sunday, the Nagorno-Karabakh leadership told Reuters the region's 120,000 Armenians did not want to live as part of Azerbaijan for fear of persecution and ethnic cleansing and started fleeing the area.Russia's RIA news agency cited early on Monday an Armenian government statement saying that more than 1,500 people had crossed into Armenia from Nagorno-Karabkah as of midnight (2000 GMT).Those with fuel had started to drive down the Lachin corridor toward the border with Armenia, according to a Reuters reporter in the Karabakh capital known as Stepanakert by Armenia and Khankendi by Azerbaijan.Reuters pictures showed dozens of cars driving out of the capital toward the corridor's mountainous curves.Armenia and Azerbaijan have fought two wars over the enclave in 30 years -- with Azerbaijan gaining back swathes of territory in and around Nagorno-Karabakh in a six-week conflict in 2020.Erdogan, who backed the Azeris with weaponry in the 2020 conflict, said last week he supported the aims of the Azerbaijan's latest military operation but played no part in it.Armenia says more than 200 people were killed and 400 wounded in last week's Azeri operation, a hostility condemned by the United States and other Western allies of Armenia.On Sunday, Azerbaijan's defence ministry said it had confiscated more military equipment from Armenian separatists, including rockets, artillery shells, mines and ammunition.The Karabakh Armenians are not accepting Azerbaijan's promise to guarantee their rights as the region is integrated. Armenia called for an immediate deployment of a U.N. mission to monitor human rights and security in the region.""Ninety-nine point nine percent prefer to leave our historic lands,"" David Babayan, an adviser to Samvel Shahramanyan, president of the self-styled Republic of Artsakh, told Reuters.",https://www.reuters.com/article/armenia-zerbaijan/turkeys-erdogan-to-meet-azeris-aliyev-as-thousands-flee-karabakh-idUSKBN30V037
