,title,date,time,content,link
7,Republicans appeal to far right to avert US government shutdown | Reuters,"September 24, 2023",10:08 PM UTC,"WASHINGTON, Sept 24 (Reuters) - With just a week before Washington runs out of money to keep the federal government fully operating, warring factions within the Republican Party in the U.S. Congress on Sunday showed no signs of coming together to pass a stopgap funding bill.Congress so far has failed to finish any of the 12 regular spending bills to fund federal agency programs in the fiscal year starting on Oct. 1.House of Representatives Speaker Kevin McCarthy will push an ambitious plan this week to win approval of four large bills, including military and homeland security funding, that he hopes would demonstrate enough progress to far-right Republicans to win their support for a stop-gap spending bill, known as a continuing resolution, or CR, as well.Republican Representative Michael McCaul, a 19-year veteran of Congress who chairs the House Intelligence Committee, urged the group of party ""holdouts"" to stop blocking Republican-backed spending bills while at the same time ""saying don't bring bipartisan bills to the floor.""""Republicans need to vote for Republican bills"" to avert a shutdown, McCaul said on ABC's ""This Week"" broadcast.But some of those ""holdouts,"" who want deep spending cuts that go beyond a deal passed earlier this year, showed no sign of relenting.""Continuing resolutions don't solve the problem. They just kick the can down the road,"" Republican Representative Tony Gonzalez told CBS News' ""Face the Nation.""In June, President Joe Biden signed into law an increase in U.S. borrowing authority that he brokered with McCarthy, which also came with around $1.5 trillion in spending cuts over 10 years.Ultra-right House Republicans want to go further with around $120 billion in additional cuts just for the new fiscal year, which could hit programs ranging from education and environmental protection to Internal Revenue Service enforcement and medical research.Similarly, Republican Representative Tim Burchett told CNN's ""State of the Union"" that he has never voted for a temporary funding bill and won't this time around.He warned that if McCarthy allows legislation to pass the House with Democratic support, ""I would look strongly at"" a move to strip McCarthy of his speakership.""This dysfunctional Washington cannot continue,"" Burchett said, referring to the way Congress handles the federal budget, which is on a path to a $1.5 trillion deficit for the fiscal year that ends on Saturday.Transportation Secretary Pete Buttigieg warned in an ABC interview that a government shutdown will require his agency to immediately suspend air traffic controller training courses at a time when air travel is ""getting back to normal"" following a high volume of flight delays and disruptions last year.Aides to McCarthy were not immediately available for comment on whether negotiations over a CR were continuing on Sunday.But he has been pushing for a 30-day bill to keep federal offices open, coupled with a strict border security plan that would basically suspend most immigration into the United States at a time of record numbers of people seeking asylum on the border with Mexico.Even some of the Senate's most conservative Republicans on Sunday appealed to House counterparts to stop blocking a stop-gap bill.""We would like for the House to begin that process of sending us a CR to keep the government open and functioning,"" Senator Marsha Blackburn told Fox Business News.Appealing to those conservatives' eagerness for conducting investigations into Biden and some other top administration officials, Blackburn added: ""If you shut down the government you can't continue that.""",https://www.reuters.com/article/usa-shutdown/republicans-appeal-to-far-right-conservatives-to-avert-us-government-shutdown-idUSKBN30U0AV
8,Striking Hollywood writers reach tentative deal with studios | Reuters,"September 25, 2023",3:31 AM UTC,"LOS ANGELES, Sept 24 (Reuters) - Hollywood's writers union reached a preliminary labor agreement with major studios on Sunday, a deal expected to end one of two strikes that have halted most film and television production and cost the California economy billions.The three-year contract still must be approved by leadership of the Writers Guild of America (WGA,) as well as union members, before it can take effect.The WGA, which represents 11,500 film and television writers, described the deal as ""exceptional"" with ""meaningful gains and protections for writers.""""This was made possible by the enduring solidarity of WGA members and extraordinary support of our union siblings who joined us on the picket lines for over 146 days,"" the negotiating committee said in a statement Sunday.The WGA settlement, while a milestone, will not return Hollywood to business as usual even if it is ratified. While writing may resume, the SAG-AFTRA actors' union remains on strike.Writers walked off the job on May 2 after negotiations reached an impasse over compensation, minimum staffing of writers' rooms, the use of artificial intelligence and residuals that reward writers for popular streaming shows, among other issues.""We stuck it out,"" WGA liaison Caroline Renard said Sunday. ""This is a union industry, and it's about the people that make the actual product that makes these company billions of dollars.""One writer posted an image on social media of a picket sign that read simply: ""The End.""The only comment from the Alliance of Motion Picture and Television Producers, the trade group representing Walt Disney (DIS.N), Netflix (NFLX.O), Warner Bros Discovery (WBD.O) and other major studios, came in a brief statement with the union.""The WGA and AMPTP have reached a tentative agreement,"" the statement said.The proposed contract is still preliminary. The WGA's negotiating committee said it would share details only after it receives final contract language. After that, the negotiators will vote on whether to recommend the deal to leadership, which must then decide if they will present it to members for a vote.Hollywood's dual strikes had shut down production of movies and TV series and sent late-night talk shows into re-runs. Efforts to restart daytime talk shows without writers, such as ""The Drew Barrymore Show,"" collapsed this month, in the face of criticism from striking writers and actors.At picket lines, protests took on the rhetoric of class warfare. Writers assailed media executives' compensation and said working conditions had made it hard for them to earn a middle-class living.Executives at times fanned tensions. Disney Chief Executive Bob Iger, fresh off a contract extension that offered an annual bonus of five times his base salary, criticized striking writers and actors as ""just not realistic"" in their demands.Iger subsequently struck a conciliatory note, citing his ""deep respect"" for creative professionals.""It's been a long road, and I'm ready to take the next step forward, which is just like healing for our guild and getting back to work on ourselves,"" ""Harlem"" writer Brandon K. Hines said on Sunday.The work stoppages took a toll on camera operators, carpenters, production assistants and other crew members, as well as the caterers, florists, costume suppliers and other small businesses that support film and television production.The economic cost is expected to total at least $5 billion in California and the other U.S. production hubs of New Mexico, Georgia and New York, according to an estimate from Milken Institute economist Kevin Klowden.Four top industry executives - Iger, Warner Bros Discovery CEO David Zaslav, Netflix co-CEO Ted Sarandos and NBCUniversal (CMCSA.O) Studio Group Chair Donna Langley - joined negotiations this week, helping to break the months-long impasse.As with past writers' strikes, this job action responds to Hollywood capitalizing on a new form of distribution - and writers seek to participate in the newfound revenue. The 100-day strike in 2007-08 focused, in part, on extending guild protections to ""new media,"" including movies and TV downloads as well as content delivered via ad-supported internet services.This time around, a central issue is residual payments for streaming services, which writers said represented a fraction of the compensation they would receive for a broadcast television show. Writers also sought limits on AI's role in the creative process. Some feared that studio executives would hand a writer an AI-generated script to revise, and pay the writer at a lower rate to rewrite or polish it. Others expressed concerns about intellectual property theft if existing scripts are used to train artificial intelligence.Reuters reported that Disney has created a task force to study artificial intelligence and how it can be applied across the entertainment conglomerate, signaling its importance.Even as studio executives celebrated the end of the longest-running writers' strike since 1988, it is only half the labor battle. The studios must still find a way to get actors back to work.SAG-AFTRA, representing 160,000 film and television actors, stunt performers, voiceover artists and other media professionals, walked off the job in July, the first time in 63 years that Hollywood faced a strike by two unions at the same time.In a statement late Sunday, SAG-AFTRA urged studio CEOs and their negotiators ""to return to the table and make the fair deal that our members deserve and demand.""At issue are questions of minimum wages for performers, protections against the use of artificial intelligence replacing human performances and compensation that reflects the value actors bring to the streaming services.",https://www.reuters.com/article/television-writers-agreement/striking-hollywood-writers-reach-tentative-deal-with-studios-idUSKBN30V035
9,"Israeli forces kill two Palestinians in West Bank raid, Hamas, emergency workers say | Reuters","September 24, 2023",4:16 PM UTC,"TULKARM, West Bank, Sept 24 (Reuters) - Israeli forces killed two Palestinians, including a fighter of the Islamist Hamas group, during a raid on a refugee camp in the West Bank on Sunday, emergency workers and Hamas said, while in Gaza Israeli strikes hit security posts for a second day.In the latest round of violence, Israeli forces raided the Nur Shams camp near the West Bank city of Tulkarm in the early hours of Sunday morning, setting off an hours-long gun battle with Palestinian fighters, witnesses said.The Israeli military said it conducted ""counterterrorism activity"" in the camp, dismantling an operational command centre equipped with computers and surveillance cameras and uncovering dozens of explosive devices and bomb-making components.""During the activity, suspects opened fire and hurled explosive devices at the forces, who responded with live fire. Hits were identified,"" the military said in a statement, adding that an Israeli soldier was moderately wounded.Hamas, which has been extending its reach away from its base in Gaza and into the West Bank, said one of the men who were killed, 21-year-old Osaid Abu Ali, was a member of its armed wing.The family of the other man, 32-year-old Abdel-Rahman Abu Daghash, said he had stepped on to the roof of his house to observe what was going on when he was killed by a sniper.""He went up to the rooftop to film the ambulances. He barely had the chance to look and the sniper targeted him,"" said his brother Mo'men Abu Daghash. ""He has nothing to do with it and he has kids and his wife is about to give birth.""There was no immediate comment from the Israeli military.Violence in the West Bank has raged for more than a year, with stepped-up Israeli military raids, increased settler assaults on Palestinian villages, and a spate of Palestinian attacks on Israelis.In the Nur Shams camp, residents took stock of rubble-strewn roads and buildings damaged during an operation that witnesses said lasted around six hours.The military said special engineering vehicles dug up roads in the camp, uncovering a large number of concealed bombs and setting off at least one roadside bomb.For much of the year, the turmoil in the West Bank has overshadowed the situation in Gaza, the blockaded coastal enclave run by Hamas, but in recent days groups of youths have held violent protests along the separation fence, throwing stones and improvised explosives and launching incendiary balloons towards Israel.On Sunday, at least five Palestinians were wounded in clashes with Israeli forces, the health ministry said.By late afternoon, the Israeli military said it conducted a second day of strikes against Hamas checkpoints in Gaza close to where rioters threw an explosive device towards its soldiers. There was no word on any casualties.In a separate incident, the Israeli military said it had detained eight students from Bir Zeit University in the West bank whom it described as wanted suspects linked to Hamas, and whom it said planned to carry out an attack in the immediate future.",https://www.reuters.com/article/israel-palestinians/israeli-forces-kill-two-palestinians-in-west-bank-raid-hamas-emergency-workers-idUSKBN30U02D
10,Biden says Republicans should live up to budget deal | Reuters,"September 24, 2023",10:32 PM UTC,"WASHINGTON, Sept 23 (Reuters) - U.S. President Joe Biden on Saturday rebuked what he called ""extreme Republicans"", saying the party's lawmakers needed to take immediate steps to prevent a government shutdown ahead of a Sept. 30 deadline.The deal reached between congressional Republican leadership and his administration in May would have funded essential domestic and national security priorities and still cut the budget deficit by $1 trillion over the next 10 years, Biden said at a congressional awards dinner on Saturday.""Now a small group of extreme Republicans don't want to live up to the deal,"" he said.A shutdown would harm food safety, cancer research and children's programs, Biden said, adding that ensuring that the government is funded is one of the core functions of congress.""It’s time for Republicans to start doing the job America elected them to do. Let's get this done,"" he said.Biden also cast his 2024 campaign against likely Republican challenger former President Donald Trump as a battle against political extremism.""I wish I could say our threat to democracy ended with our victory in 2020 but it didn't,"" Biden said. ""Our democracy is still at stake, don't kid yourself.""",https://www.reuters.com/article/usa-shutdown-biden/biden-says-republicans-should-live-up-to-budget-deal-idUSKBN30U01H
11,Serb gunmen battle police in Kosovo monastery siege; four dead | Reuters,"September 24, 2023",8:38 PM UTC,"NORTH MITROVICA, Kosovo, Sept 24 (Reuters) - Ethnic Serb gunmen in armoured vehicles stormed a village in north Kosovo on Sunday, battling police and barricading themselves in a monastery in a resurgence of violence in the restive north that killed four people.The siege centred on a Serbian Orthodox monastery near the village of Banjska in the Serb-majority region where monks and pilgrims hid inside a temple as a shootout raged.One police officer and three of the attackers died, according to authorities in Kosovo and Serbia.Ethnic Albanians form the vast majority of the 1.8 million population of Kosovo, a former province of Serbia.But some 50,000 Serbs in the north have never accepted Kosovo's 2008 declaration of independence and still see Belgrade as their capital, more than two decades after a Kosovo Albanian guerrilla uprising against repressive Serbian rule.A group of Kosovo Serbs positioned trucks on a bridge into the village, shooting at police who approached them, before the battle moved to the nearby monastery, according to accounts by both Kosovo police and Serbian President Aleksandar Vucic.The gunmen had left the monastery by night, the Serbian Orthodox Church said, though it was unclear where they went.Vucic said the action was a rebellion against Kurti, who has refused to form an association of Serb municipalities in north Kosovo. ""Serbia will never recognise independent Kosovo, you can kill us all,"" he said.Two Serbs were seriously injured and a fourth among them may have died, Vucic said. He condemned the killing of the police officer and urged restraint from Kosovo Serbs.The Serbian Orthodox Church's diocese of Raska-Prizren, which includes Banjska, said men in an armoured vehicle entered the monastery compound, forcing monks and visiting faithful to lock themselves inside the temple.The Kosovo police later said they had entered the monastery and were checking for possible infiltrators among worshippers. Three of their personnel were also injured, as well as the fatality in their ranks, police said.Kosovo's Interior Minister Xhelal Svecla said police found a large number of heavy weapons, explosives and uniforms ""that were enough for hundreds of other attackers"", indicating preparations for a massive assault.The head of the U.N. mission in Kosovo, Caroline Ziadeh, and European Union foreign policy chief Josep Borrell condemned the violence.Borrell talked with both Kurti and Vucic, according to his office.NATO troops, along with members of the EU police force EULEX and Kosovo police, could be seen patrolling the road leading to Banjska, according to a Reuters reporter nearby.Kosovo border police closed two crossings with Serbia.Serbs in north Kosovo have long demanded the implementation of a EU-brokered 2013 deal for the creation of an association of autonomous municipalities in their area.EU-sponsored talks on normalising relations between Serbia and Kosovo stalled last week, with the bloc blaming Kurti for failing to set up the association.Pristina sees the plan as a recipe for a mini-state within Kosovo, effectively partitioning the country along ethnic lines.Serbia still formally deems Kosovo to be part of its territory, but denies suggestions of whipping up strife within its neighbour's borders. Belgrade accuses Pristina of trampling on the rights of minority Serbs.Unrest intensified when ethnic Albanian mayors took office in north Kosovo after April elections the Serbs boycotted.Clashes in May injured dozens of protesters and NATO alliance peacekeepers.NATO retains 3,700 troops in Kosovo, the remainder of an original 50,000-strong force deployed in 1999.The area of north Kosovo where Serbs form a majority is in important ways a virtual extension of Serbia. Local administration and public servants, teachers, doctors and big infrastructure projects are paid for by Belgrade.",https://www.reuters.com/article/kosovo-serbia-shooting/serb-gunmen-battle-police-in-kosovo-monastery-siege-four-dead-idUSKBN30U02Q
12,Explainer: Why Kosovo's stand-off with Serbs goes on 15 years after statehood | Reuters,"September 24, 2023",5:57 PM UTC,"Sept 24 (Reuters) - The storming of a north Kosovo monastery has thrown attention on persistent trouble in the ethnic Serbian-majority region 15 years after Pristina declared independence.Here are facts about the unrest.Independence for ethnic Albanian-majority Kosovo came on Feb. 17, 2008, almost a decade after a guerrilla uprising against repressive Serbian rule.It is recognised by more than 100 countries.Serbia, however, still formally deems Kosovo to be part of its territory. It accuses Kosovo's central government of trampling on the rights of ethnic Serbs but denies accusations of whipping up strife within its neighbour's borders.Serbs account for 5% of Kosovo's 1.8 million people, and ethnic Albanians about 90%. Some 50,000 Serbs in north Kosovo, on the border with Serbia, vent their rejectionism by refusing to pay the state utility for energy they use and often attacking police who try to make arrests.All of them receive benefits from Serbia's budget and pay no taxes either to Pristina or Belgrade.Unrest in the region intensified when ethnic Albanian mayors took office in northern Kosovo's Serb-majority area after April elections the Serbs boycotted, a move that led the U.S. and its allies to rebuke Pristina.Last December, North Kosovo Serbs erected multiple roadblocks and exchanged fire with police after a former Serb policeman was arrested for allegedly assaulting serving police officers during a previous protest.But tensions had been ticking upward for months in a dispute over car license plates. Kosovo has for years wanted Serbs in the north to switch their Serbian license plates, dating to the pre-independence era, to ones issued by Pristina, as part of its policy to assert authority over all of Kosovo territory.Last July, Pristina announced a two-month window for the plates to be switched over, triggering unrest, but later agreed to push the implementation date back to the end of 2023.Ethnic Serb mayors in northern municipalities, along with local judges and 600 police officers, resigned in November last year in protest at the looming switch, deepening dysfunction and lawlessness in the region.Serbs in Kosovo seek to create an association of majority-Serb municipalities operating with considerable autonomy.Pristina rejects this as a recipe for a mini-state within Kosovo, effectively partitioning the country along ethnic lines.Serbia and Kosovo have made little progress on this and other issues since committing in 2013 to a European Union-sponsored dialogue aimed at normalising ties - for both a requirement for EU membership.The transatlantic NATO military alliance retains 3,700 peacekeeping troops in Kosovo, the remainder of an original 50,000-strong force deployed in 1999.The alliance says it would intervene in line with its mandate if Kosovo were at risk of renewed conflict. The EU's EULEX mission, begun in 2008 to train domestic police and crack down on graft and gangsterism, retains 200 special police officers in Kosovo.U.S. and EU envoys are pressing Serbia and Kosovo to approve a plan presented in mid-2022 under which Belgrade would stop lobbying against a Kosovo seat in international organisations including the United Nations.Kosovo would commit to form an association of Serb-majority municipalities. And both sides would open representative offices in each other's capital to help resolve outstanding disputes.But talks on normalising relations between the two former wartime foes stalled last week, with the EU blaming Kosovo's Prime Minister Albin Kurti for failing to set up the association of municipalities.Kurti, who had agreed such an association should have only limited powers whose decisions could be overruled by central government, accused the EU mediator of siding with Serbia to pressure him to implement only one part of the deal.Serbia's president appears ready to approve the plan, warning recalcitrant nationalists in parliament that Belgrade will otherwise face damaging isolation in Europe.But with nationalist hardliners powerful on both sides, not least among north Kosovo Serbs, no breakthrough is on the horizon.The area of north Kosovo where Serbs form a majority is in important ways a virtual extension of Serbia. Local administration and public servants, teachers, doctors and big infrastructure projects are paid for by Belgrade.Local Serbs fear that once fully integrated within Kosovo they could lose benefits such as Serbia's free public healthcare and be forced onto Kosovo's private healthcare system.They also fear pensions would be smaller, given that the average monthly pension in Kosovo is worth 100 euros ($107)compared with 270 euros in Serbia.($1 = 0.9388 euros)",https://www.reuters.com/article/kosovo-serbs/explainer-why-kosovos-stand-off-with-serbs-goes-on-15-years-after-statehood-idUSKBN30U0A8
